{
  "$schema": "http://json-schema.org/draft-07/schema#",
  "$id": "https://aer.sequence.org/schemas/v1/HardwareAttestation.schema.json",
  "title": "Hardware Remote Attestation Evidence Specification (IETF RATS RFC 9334 / DAA-ZK Anchor)",
  "description": "Formal specification for cryptographically verifiable hardware evidence conforming to the IETF Remote Attestation Procedures (RATS, RFC 9334) architecture. Enforces a bijective mapping between trusted silicon state and autonomous node identity while concealing persistent hardware identifiers via zero-knowledge Pedersen commitments.",
  "type": "object",
  "required": [
    "schema_version",
    "node_id",
    "blinded_silicon_commitment",
    "platform_pcr_digest",
    "attestation_key_quote",
    "zk_vendor_membership_proof",
    "silicon_vendor",
    "timestamp",
    "nonce"
  ],
  "additionalProperties": false,
  "properties": {
    "schema_version": {
      "type": "string",
      "pattern": "^1\\.[0-9]+\\.[0-9]+$",
      "description": "Semantic versioning string of this formal schema specification (e.g. 1.0.0)."
    },
    "node_id": {
      "type": "string",
      "pattern": "^0x[a-fA-F0-9]{40}$",
      "description": "EVM-standard 20-byte hexadecimal address derived from the node operational ECDSA/Ed25519 public key."
    },
    "blinded_silicon_commitment": {
      "type": "string",
      "pattern": "^0x[a-fA-F0-9]{64}$",
      "description": "32-byte Pedersen commitment Commit(Chip_Secret, r) blinding the physical silicon identifier into a zero-knowledge nullifier."
    },
    "platform_pcr_digest": {
      "type": "string",
      "pattern": "^0x[a-fA-F0-9]{64}$",
      "description": "SHA-256 composite measurement digest of Platform Configuration Registers (PCR 0-7: firmware, secure boot state, and kernel integrity measurements)."
    },
    "attestation_key_quote": {
      "type": "object",
      "required": [
        "ak_public_key",
        "quote_signature",
        "quote_payload"
      ],
      "additionalProperties": false,
      "properties": {
        "ak_public_key": {
          "type": "string",
          "minLength": 32,
          "description": "DER or PEM encoded public key of the Attestation Key (AK) generated within the trusted hardware boundary."
        },
        "quote_signature": {
          "type": "string",
          "pattern": "^0x[a-fA-F0-9]+$",
          "description": "Hexadecimal cryptographic signature generated by the hardware AK over the quote_payload and replay-prevention nonce."
        },
        "quote_payload": {
          "type": "string",
          "minLength": 16,
          "description": "TPM2B_ATTEST or TEE hardware quote data structure encoded in base64 or hexadecimal format."
        }
      }
    },
    "zk_vendor_membership_proof": {
      "type": "object",
      "required": [
        "proof_type",
        "proof_bytes",
        "public_inputs"
      ],
      "additionalProperties": false,
      "properties": {
        "proof_type": {
          "type": "string",
          "enum": [
            "ZK_SNARK_GROTH16",
            "ZK_STARK",
            "DAA_RSA_SHA256",
            "WOT_MULTISIG"
          ],
          "description": "Designated zero-knowledge proof or Direct Anonymous Attestation (DAA) scheme proving Root CA membership without certificate serial disclosure."
        },
        "proof_bytes": {
          "type": "string",
          "pattern": "^0x[a-fA-F0-9]+$",
          "description": "Serialized byte array of the zero-knowledge or DAA cryptographic proof."
        },
        "public_inputs": {
          "type": "array",
          "items": {
            "type": "string",
            "pattern": "^0x[a-fA-F0-9]+$"
          },
          "description": "Public signals for circuit verification (e.g. root hash of the vendor CA Merkle accumulation tree, challenge hash)."
        }
      }
    },
    "silicon_vendor": {
      "type": "string",
      "enum": [
        "TCG_TPM20",
        "INTEL_SGX_TDX",
        "AMD_SEV_SNP",
        "ARM_CCA",
        "OPENTITAN_RISCV",
        "KEYSTONE_TEE",
        "SOFTWARE_MOCK"
      ],
      "description": "Standardized hardware security architecture and isolation subsystem designation."
    },
    "silicon_firmware_version": {
      "type": "string",
      "maxLength": 128,
      "description": "Reported firmware and microcode release identifier certified by the secure element."
    },
    "timestamp": {
      "type": "integer",
      "minimum": 1700000000,
      "description": "Unix epoch timestamp in seconds at the time of attestation generation."
    },
    "nonce": {
      "type": "string",
      "pattern": "^0x[a-fA-F0-9]{64}$",
      "description": "32-byte cryptographic nonce provided by the verifier to guarantee freshness and prevent replay attacks."
    }
  }
}
